{
  "schema": "urn:ai-friends:schema:agent:v1:identity",
  "principal": { "kind": "agent", "id": "agent:runner-7f3a" },
  "display_name": "Исполнитель задач смены",
  "state": "active",
  "created_at": "2026-08-30T09:05:00Z",
  "authentication": { "method": "control-plane-token" },
  "on_behalf_of": { "kind": "human", "id": "human:op-a1b2" },
  "home_device": "device:win-lab-01",
  "agent_profile": {
    "runtime": "mcp_client",
    "model_hint": "справочно, на права не влияет",
    "max_session_seconds": 3600,
    "supervision": "supervised",
    "release": "A",
    "accepts_provenance": ["operator", "policy", "system", "tool_output", "remote_host"]
  }
}
