{
  "schema": "urn:ai-friends:schema:agent:v1:identity",
  "principal": { "kind": "device", "id": "device:win-lab-01" },
  "display_name": "Рабочая станция лаборатории 01",
  "state": "active",
  "created_at": "2026-08-30T08:00:00Z",
  "authentication": { "method": "mtls" },
  "enrollment": {
    "enrolled_at": "2026-08-30T08:00:00Z",
    "enrolled_by": { "kind": "human", "id": "human:op-a1b2" },
    "certificate_thumbprint": "sha256:c3d4e5f607182930c3d4e5f607182930c3d4e5f607182930c3d4e5f607182930",
    "key_storage": "tpm",
    "certificate_expires_at": "2026-09-06T08:00:00Z",
    "platform": "windows"
  }
}
